Date,Url,Text,Mark
2023-10-18,https://www.nasdaq.com/articles/alcoa-aa-q3-earnings%3A-how-key-metrics-compare-to-wall-street-estimates,"For the quarter ended September 2023, Alcoa (AA) reported revenue of $2.6 billion, down 8.7% over the same period last year. EPS came in at -$1.14, compared to -$0.33 in the year-ago quarter.
The reported revenue represents a surprise of +0.42% over the Zacks Consensus Estimate of $2.59 billion. With the consensus EPS estimate being -$1.13, the EPS surprise was -0.89%.
While investors closely watch year-over-year changes in headline numbers -- revenue and earnings -- and how they compare to Wall Street expectations to determine their next course of action, some key metrics always provide a better insight into a company's underlying performance.
Since these metrics play a crucial role in driving the top- and bottom-line numbers, comparing them with the year-ago numbers and what analysts estimated about them helps investors better project a stock's price performance.
Here is how Alcoa performed in the just reported quarter in terms of the metrics most widely monitored and projected by Wall Street analysts:
Average realized third-party price per metric ton of alumina: $354 compared to the $335.27 average estimate based on two analysts.
Average realized third-party price per metric ton of aluminum: $2,647 versus the two-analyst average estimate of $2,694.79.
Third-party alumina shipments in Tons: 2,374 Kmt versus 2,266.81 Kmt estimated by two analysts on average.
Third-party aluminum shipments in Tons: 630 Kmt versus the two-analyst average estimate of 649.11 Kmt.
Total sales- Alumina: $1.34 billion versus $1.17 billion estimated by two analysts on average. Compared to the year-ago quarter, this number represents a +7% change.
Total sales- Aluminum: $1.65 billion compared to the $1.70 billion average estimate based on two analysts. The reported number represents a change of -17% year over year.
Third-party sales- Bauxite: $111 million versus $98.40 million estimated by two analysts on average. Compared to the year-ago quarter, this number represents a +88.1% change.
Third-party sales- Alumina: $846 million versus the two-analyst average estimate of $768.36 million. The reported number represents a year-over-year change of +1.7%.
Intersegment sales- Aluminum: $4 million versus $4.50 million estimated by two analysts on average. Compared to the year-ago quarter, this number represents a -60% change.
Total Third-party sales: $2.60 billion compared to the $2.62 billion average estimate based on two analysts. The reported number represents a change of -9.2% year over year.
Intersegment sales- Alumina: $381 million versus the two-analyst average estimate of $357.20 million. The reported number represents a year-over-year change of -8.9%.
Third-party sales- Aluminum: $1.64 billion versus the two-analyst average estimate of $1.75 billion. The reported number represents a year-over-year change of -16.8%.
View all Key Company Metrics for Alcoa here>>>

Shares of Alcoa have returned -2% over the past month versus the Zacks S&P 500 composite's -1.6% change. The stock currently has a Zacks Rank #3 (Hold), indicating that it could perform in line with the broader market in the near term.
Zacks Names #1 Semiconductor Stock
It's only 1/9,000th the size of NVIDIA which skyrocketed more than +800% since we recommended it. NVIDIA is still strong, but our new top chip stock has much more room to boom.
With strong earnings growth and an expanding customer base, it's positioned to feed the rampant demand for Artificial Intelligence, Machine Learning, and Internet of Things. Global semiconductor manufacturing is projected to explode from $452 billion in 2021 to $803 billion by 2028.
See This Stock Now for Free >>
Want the latest recommendations from Zacks Investment Research? Today, you can download 7 Best Stocks for the Next 30 Days. Click to get this free report
Alcoa (AA) : Free Stock Analysis Report
To read this article on Zacks.com click here.
Zacks Investment Research
The views and opinions expressed herein are the views and opinions of the author and do not necessarily reflect those of Nasdaq, Inc.",1
2023-10-18,https://www.nasdaq.com/articles/alcoa-aa-reports-q3-loss-tops-revenue-estimates,"Alcoa (AA) came out with a quarterly loss of $1.14 per share versus the Zacks Consensus Estimate of a loss of $1.13. This compares to loss of $0.33 per share a year ago. These figures are adjusted for non-recurring items.
This quarterly report represents an earnings surprise of -0.89%. A quarter ago, it was expected that this bauxite, alumina and aluminum products company would post a loss of $0.59 per share when it actually produced a loss of $0.35, delivering a surprise of 40.68%.
Over the last four quarters, the company has surpassed consensus EPS estimates two times.
Alcoa, which belongs to the Zacks Metal Products - Distribution industry, posted revenues of $2.6 billion for the quarter ended September 2023, surpassing the Zacks Consensus Estimate by 0.42%. This compares to year-ago revenues of $2.85 billion. The company has topped consensus revenue estimates four times over the last four quarters.
The sustainability of the stock's immediate price movement based on the recently-released numbers and future earnings expectations will mostly depend on management's commentary on the earnings call.
Alcoa shares have lost about 38.9% since the beginning of the year versus the S&P 500's gain of 13.9%.
What's Next for Alcoa?
While Alcoa has underperformed the market so far this year, the question that comes to investors' minds is: what's next for the stock?
There are no easy answers to this key question, but one reliable measure that can help investors address this is the company's earnings outlook. Not only does this include current consensus earnings expectations for the coming quarter(s), but also how these expectations have changed lately.
Empirical research shows a strong correlation between near-term stock movements and trends in earnings estimate revisions. Investors can track such revisions by themselves or rely on a tried-and-tested rating tool like the Zacks Rank, which has an impressive track record of harnessing the power of earnings estimate revisions.
Ahead of this earnings release, the estimate revisions trend for Alcoa: mixed. While the magnitude and direction of estimate revisions could change following the company's just-released earnings report, the current status translates into a Zacks Rank #3 (Hold) for the stock. So, the shares are expected to perform in line with the market in the near future. You can see the complete list of today's Zacks #1 Rank (Strong Buy) stocks here.
It will be interesting to see how estimates for the coming quarters and current fiscal year change in the days ahead. The current consensus EPS estimate is -$0.29 on $2.7 billion in revenues for the coming quarter and -$1.79 on $10.68 billion in revenues for the current fiscal year.
Investors should be mindful of the fact that the outlook for the industry can have a material impact on the performance of the stock as well. In terms of the Zacks Industry Rank, Metal Products - Distribution is currently in the top 22% of the 250 plus Zacks industries. Our research shows that the top 50% of the Zacks-ranked industries outperform the bottom 50% by a factor of more than 2 to 1.
Another stock from the same industry, Constellium (CSTM), has yet to report results for the quarter ended September 2023. The results are expected to be released on October 25.
This aluminum company is expected to post quarterly earnings of $0.44 per share in its upcoming report, which represents a year-over-year change of -50.6%. The consensus EPS estimate for the quarter has remained unchanged over the last 30 days.
Constellium's revenues are expected to be $2.01 billion, down 1.3% from the year-ago quarter.
Zacks Names #1 Semiconductor Stock
It's only 1/9,000th the size of NVIDIA which skyrocketed more than +800% since we recommended it. NVIDIA is still strong, but our new top chip stock has much more room to boom.
With strong earnings growth and an expanding customer base, it's positioned to feed the rampant demand for Artificial Intelligence, Machine Learning, and Internet of Things. Global semiconductor manufacturing is projected to explode from $452 billion in 2021 to $803 billion by 2028.
See This Stock Now for Free >>
Want the latest recommendations from Zacks Investment Research? Today, you can download 7 Best Stocks for the Next 30 Days. Click to get this free report
Alcoa (AA) : Free Stock Analysis Report
Constellium SE (CSTM) : Free Stock Analysis Report
To read this article on Zacks.com click here.
Zacks Investment Research
The views and opinions expressed herein are the views and opinions of the author and do not necessarily reflect those of Nasdaq, Inc.",1
2023-10-18,https://www.nasdaq.com/articles/alcoa-corp.-q3-loss-decreases-but-misses-estimates,"(RTTNews) - Alcoa Corp. (AA) announced Loss for third quarter that decreased from last year and beat the Street estimates.
The company's earnings totaled -$168 million, or -$0.94 per share. This compares with -$746 million, or -$4.17 per share, in last year's third quarter.
Excluding items, Alcoa Corp. reported adjusted earnings of -$202 million or -$1.14 per share for the period.
Analysts on average had expected the company to earn -$1.02 per share, according to figures compiled by Thomson Reuters. Analysts' estimates typically exclude special items.
The company's revenue for the quarter fell 8.8% to $2.60 billion from $2.85 billion last year.
Alcoa Corp. earnings at a glance (GAAP) :
-Earnings (Q3): -$168 Mln. vs. -$746 Mln. last year. -EPS (Q3): -$0.94 vs. -$4.17 last year. -Analyst Estimates: -$1.02 -Revenue (Q3): $2.60 Bln vs. $2.85 Bln last year.
The views and opinions expressed herein are the views and opinions of the author and do not necessarily reflect those of Nasdaq, Inc.",1
2023-10-18,https://www.nasdaq.com/articles/alcoa-q3-23-earnings-conference-call-at-5%3A00-pm-et,"(RTTNews) - Alcoa Corp. (AA) will host a conference call at 5:00 PM ET on Oct. 18, 2023, to discuss Q3 23 earnings results.
To access the live webcast, log on to https://investors.alcoa.com/events-and-presentations/events-calendar/default.aspx
To listen to the call, dial +1 (877) 883-0383 (US) or +1 (412) 902-6506 (International), Conference ID: 4079492.
For a replay call, dial +1 (877) 344-7529 (US) or +1 (412) 317-0088 (International), Access Code: 4690998.
The views and opinions expressed herein are the views and opinions of the author and do not necessarily reflect those of Nasdaq, Inc.",1
2023-10-18,https://www.nasdaq.com/articles/alcoa-q3-23-earnings-conference-call-at-5%3A00-pm-et,0,0
2023-10-18,https://www.nasdaq.com/articles/alcoa-aa-q3-earnings%3A-how-key-metrics-compare-to-wall-street-estimates,0,0
2023-10-18,https://www.nasdaq.com/articles/alcoa-aa-reports-q3-loss-tops-revenue-estimates,0,0
2023-10-18,https://www.nasdaq.com/articles/alcoa-corp.-q3-loss-decreases-but-misses-estimates,0,0
